text	scientific_claim
Big oil asks government to protect its Texas facilities from climate change ...with no sense of irony https://t.co/5LwBASECW3 https://t.co/if4Y5Hi83Y	0.0
How can greenhouse gases be removed from the atmosphere? https://t.co/nb9jeqOkzU #climatechange #climateaction  #environment  #energy https://t.co/XMeugvCdzW	1.0
Paris Agreement 2015/Art.2.1(c): Making finance flows consistent with a pathway towards low GHG emissions. https://t.co/wwdORYyv3J #climatechange #climateaction  #environment  #energy https://t.co/wMj1wvV4bK	0.0
I just cast my ballot for: ✅Equality ✅Women’s rights ✅Climate change ✅Education ✅Florida’s future  While voting for: ➡️@MayorLevine https://t.co/tjJ2AJwt9p	0.0
A note on #climatechange. (@billmckibben) https://t.co/o3Dfaos3WW	0.0
Call it global warming or a heatwave but there's no arguing that it is still hot &amp; bright out there. Most people don't realize that all sunscreen is not created equal, see the difference, feel the difference first hand with Obagi sun-care! https://t.co/OeN0F4SOSH	0.0
Why Climate Change Causes More Deaths: https://t.co/l0QvJthj1O #climatechange #climateaction  #environment  #energy https://t.co/kQsIT0SthM	1.0
Paris Agreement 2015/Art.2.1(b):Increasing the ability to adapt to the adverse impacts of climate change. https://t.co/wwdORYQ5Vh #climatechange #climateaction  #environment  #energy https://t.co/nJOae7DcgD	0.0
@senJamesInhofe Oh - ur a nut   I came here because of ur insane statement blaming the longest serving statesman Sen John McCain for the petty, spiteful actions of a child that personally attacked anAmerican hero over a disagreement   but if u feel climate change is a hoax - ur not too bright https://t.co/21NVwkno5c	0.0
Everything almost dry and death.. No Water No Electricity No Education No Hospital No Life No Money Nobody wants to live in here.. Global Warming Suckkaa! 115° F Dammit!! https://t.co/xy9sOZqoOr	0.0
*walks into environmental science class* Professor: “GLOBAL WARMING IS A MYTH” Me: https://t.co/gbagkQI3Hq	0.0
It's almost 2 AM lol but I wanted to also make smth like all the cool limited-palette pride icons I've been seeing around, so I used it as a chance to try out some digital painting again since it's been too long. Speedpaint going up on patreon later! https://t.co/Al2SQb20H6	0.0
funk pop techno music np The Veldt by deadmau5 on https://t.co/8UyDnMXznL https://t.co/ENd7fjxzl8	0.0
Dear Ladies,   Are you interested in Learning Digital Marketing Getting certified Getting listed on a website as a freelance Digital Marketer Getting recruited to Top Personal and Corporate Brands   If yes, Send a message to https://t.co/A9NKRpWjFA   This is opened to 5 ladies only. https://t.co/WUJHgt4o5H	0.0
I wanted to post this comment conversation on my Elliot Rodger video. Not to shame this guy but because I think it can be helpful at clarifying some of my points in the video. https://t.co/X8JLpWQLmB	0.0
Join us for an evening under the stars with Ross Newell! 🎵 🎶 🎵  Ross Newell, now touring as a solo artist is best known as lead singer and songwriter in The Mulligan Brothers from Mobile AL. Get your tickets here! &gt;&gt; https://t.co/sixtetc9dx https://t.co/o8L092E1pe	0.0
@sixnnx @williammahan50 Bitcoin Massive Adoption Is Coming https://t.co/fzj61shekp	0.0
It'll be easier for you than it was for Jason…Student Cybersecurity Scarehouse, October 31 at 11 am – 3 pm, William Pitt Union. https://t.co/RrlWm5nWzihttps://t.co/iNKvEt4i8x	0.0
To all who have served, thank you for your passion, your patriotism, and your sacrifice. We are eternally grateful. https://t.co/naTHCTIzND	0.0
Based purely on technicals, this is not a chart I'd wanna be short https://t.co/3cRpfeWf8m	0.0
@ynotbelieve @hon3y_dipp3d 🎁🖥 SHOP our CYBER MONDAY SALE! FREE luxurious extensions for ALL hair types! (While supplies last) https://t.co/qRmjYTZbpAhttps://t.co/TqeAGE9Gzn	0.0
RADIO KLUB // Only the best House Music and Techno with the best DJs from Ibiza, London, Berlin, Amsterdam, Barcelona, New york (DEFECTED, DRUMCODE, TERMINAL, NOIR MUSIC, OCTOPUS RECORDINGS, SUARA, BEDROCK RECORDS, TOOLROOM RECORDS, TRONIC, SECOND STATE, DIYNAMIC) https://t.co/HBah63nEc6	0.0
"@Techno_Fog @almostjingo @JohnWHuber @ProfMJCleveland @LeeSmithDC @themarketswork @DevinNunes @KerriKupecDOJ 9)  The OIG report answers that question by giving a timeline of around mid-January.  When the primary sub-source was questioned.   As written: ""shortly after the FBI filed the Carter Page FISA Renewal""  (January 12th, 2017). https://t.co/C5gMZZsW34"	0.0
RT @SarKazztic: Praying for Philippines to be safe from #coronavirus. This is so scary and alarming. 😣https://t.co/OrUoioWAEG	0.0
How to spot symptoms of the coronavirus https://t.co/sNOjOMJVda https://t.co/n8urqZtftz	1.0
Curious about the Coronavirus? Where it came from &amp; why? Or Autism, Alzheimer's, Addictions, Antichrist, Bitcoin, Creationism, Evolution, Libido, Mass Human Extinction, Murder, Political Cowardice, Suicide, Why Cops Kill? Many Answers Are  In My Book: https://t.co/LiX5IFJ1dI 47 https://t.co/uHxycaBqP7	0.0
the coronavirus:  me, a hypochondriac with a horrible immune system that gets the flu literally every other week https://t.co/iM9uUvtDtv	0.0
@CarWale this bug in your mobile app exists from ages. Y don't u solve it? https://t.co/Zo6e8EjnrV	0.0
[Steve Hanke: You Should Avoid Bitcoin Like The Plague]   According to https://t.co/RNW6FI6SUn, Johns Hopkins Univers...   https://t.co/HJ2Znnfqe0 https://t.co/J3GJNljKK9	0.0
Skull Skateboarding t shirt design - Quilimo ➡File type : psd, png ➡https://t.co/pzipLlhXsk ➡ Instant Digital Download https://t.co/1tktvtkyC4	0.0
In days to come researchers can explore how the shutdown impacted womens/mens research careers. Work-life balance  put to the test; time to write expanded/contracted; the imperative of travel was questioned; digital communication grew. @Research_Voice @GenderPORTal  @Journal_NORA https://t.co/k0lOZNqmjs	0.0
Guess Who's Most Effective At Combating Global Warming https://t.co/rb5F3nMp3R https://t.co/CDtXE7y9sO	0.0
Great to hear that 130 years after Van Gogh cut off his own ear, the @vangoghmuseum is taking the much more sensible move of cutting ties with @Shell and taking a stand against #climatechange. https://t.co/gbR3RYrans	0.0
Nuclear Power Image, Then &amp; Now. The climate change debate has changed the way we look at nuclear power. By Steve Greenberg. https://t.co/5YHOzkO7Wt	1.0
@QuentinDempster @msrose2343 Morrison is a global warming denialist so he will ditch Paris, push coal and sit by twiddling his thumbs as our farms turn to dust... https://t.co/j52RoIwwwE	0.0
Comment: Why I Remain Optimistic about Stopping Earth Becoming a ‘Hothouse’   https://t.co/yAsxH6eUc4#climatechange #globalwarming https://t.co/gul0Xkbbys	0.0
On model selection criteria for climate change impact studies. https://t.co/RCtlZSY5bM https://t.co/X8wWyPOpSx	1.0
What is the Kyoto Protocol? https://t.co/nb9jeqOkzU #climatechange #climateaction  #environment  #energy https://t.co/VoTDpURa2I	0.0
We need your input: Do you think global warming is caused by humans? Click Link #environment #green #climatechange #sustainability https://t.co/NwfF3Z2gOo?https://t.co/tusr4QS3sb	1.0
3/ •Gender, Environment &amp;Climate Change;  •Gender, Media &amp;Information Communication Technology (ICTS); •Gender &amp;Disability  •Gender, Culture &amp;Region  Its time to comply with the statutes of the National Gender Policy and constitutional provisions that promote gender equality https://t.co/xKJaqebxEq	0.0
@TajinderBagga @narendramodi @ianuragthakur @AmitShah @smritiirani @amitmalviya @PiyushGoyal @arunjaitley दिक्कत ये है कि when no one on earth had a digital camera how come Mr Modi had one and even email account? https://t.co/pbNKrVEHj9	0.0
Happy bday to one of my my fav artist and Atlanta’s finest Andre 3000 aka 3stacks. Maybe two of the best to ever do it in their own professions. 🤷🏽‍♂️🐐....@calvinjohnsonjr . 🐝🐝🐝🐝🐝🐝🏆. GTech can’t wait to see them both this fall when we take The Flats. 😎 https://t.co/LA8GyrPWsw	0.0
“I later transferred the encrypted files that control access to these Bitcoin in 2011, as explained below. In June of 2011, I took steps to consolidate the Bitcoin that I mined with Bitcoin that I acquired and other assets. In October 2012, a formal trust document was executed” https://t.co/M5LCxdCs5X	0.0
From Anderson Township’s Facebook Page:  And the winner is…   Thanks to all who submitted playful photos for this year’s Independence Day Parade photo contest!  Jessica Cunningham’s photo was selected the winner and captures the color and patriotism from that morning. https://t.co/mVIQmGKqMh	0.0
Good luck to Elliot Giles, Jamie Webb and Kyle Langford as they prepare for tonight’s 800m semi finals at the IAAF World Championships in Doha https://t.co/j7Xp49G1CO	0.0
Trending fairy Jongdae in Korea’s trends (updated):   &gt; Jongdae’s fansign &gt; Soondingies &gt; Doctor’s coat &gt; cardiothoracic surgery https://t.co/ykWKmL5G2N	0.0
Teamfight Tactics (Riot Games, 2019) https://t.co/j3VAqz1myZ	0.0
Yesss Charlie! I was the first to meet with Charlie Hecht when he had the idea to start his Patriotism Project  He's such an inspiring and determined kid, I'm glad he's getting that recognition nationally!   https://t.co/FJcfnUTm8E via @WTKR3 https://t.co/M4GtdCTfrT	0.0
In the spirit of Black Friday/Cyber Monday, all of my kits at https://t.co/8xfNc5Ug6H are 10% off! Make sure you enter “10-OFF” at checkout to get the discount. https://t.co/qBUVBFQXZF	0.0
Stopping by Andorra on our way South.  Hoping to meet the King.   Peddling Cryptocurrency's dark side - Centralized, privacy devouring, as a way to rule the world.   Or perhaps I'm peddling something else. https://t.co/UuxHLdobBi	0.0
RT @erikaxgio: Stay safe out there #coronavirus https://t.co/2tP9HtjQSS	0.0
Me after getting the coronavirus https://t.co/7VYpr2TSpc	0.0
@Lardman316 @beazer86 Mate they only coronavirus you’ve got is from drinking to much of these https://t.co/onQmsIJIa5	0.0
im sick today, we coronavirus 😂😂😂👏👏 https://t.co/mZgKNyGBav	0.0
That #coronavirus reminds me of Planet of the Apes. When it got on humans it killed them and it spread so easily with a simple sneeze or cough.  The sequel to the movie there was only a few humans left on Earth.  Was the movie telling us something? https://t.co/uS7fXyjRPF	1.0
Wuhan Coronavirus and the Tacitus Trap https://t.co/i1F5jfcPwc https://t.co/iG9uOmeKkQ	0.0
We’re committed to supporting the global response to the #coronavirus by enabling access to the latest available research, evidence, and data on our dedicated page. All content is free and will continually be updated. https://t.co/lrjLr05d7t https://t.co/IftR9LjRko	0.0
@MartinSLewis Hi, My employer has terminated my contract with 1 week notice. They gave the reason for my termination as Covid-19, I work in digital marketing and had been working from home. They refused to give me the Furlough scheme even though I have requested to be on it. https://t.co/HTtktvBKcD	0.0
With telecommuting way up in @bellevuewa due to COVID-19 &amp; increased telecommuting, there are fewer cars on the road. But that doesn't mean you get to go faster than the posted speed limit. It applies no matter what, so slow it down! Vision Zero: https://t.co/etU6onmqnC; @bvuepd https://t.co/m8Pijcqu9M	0.0
A large theropod from the Elliot Formation, Dracovenator regenti lived in the early jurassic of South Africa being a major predator of the varied herbivores that existed in the region, including small sauropodomorphs and the minuscule ornithischians. https://t.co/8B9vYOpiL4	0.0
The pivot to whiskey https://t.co/ekXCPm8ZnN https://t.co/7aaearrBmB	0.0
What is the purpose of the Intergovernmental Panel on Climate Change? https://t.co/wwdORYyv3J #climatechange #climateaction  #environment  #energy https://t.co/E5cTBrHANP	0.0
Climate Change Facts About Our World Governments https://t.co/KPihCXzzvp https://t.co/aDeAPqjlUZ	0.0
One tree can start a forest. https://t.co/Mj2DeG1bzs #climatechange #climateaction  #environment  #energy https://t.co/aV1pbbZuYi	0.0
Worldwide Geothermal Energy Potential: https://t.co/LVGD1qdYt6 #climatechange #climateaction  #environment  #energy https://t.co/CYzenJBVG5	0.0
Climate Change and Dystopian Stories: A Conversation with J.G. Follansbee https://t.co/8HEBIvlD5vhttps://t.co/P7BHZwjvWu	0.0
Can we afford our appetite for concrete in an era of climate change? https://t.co/2UwyiAICmHhttps://t.co/x58UTumdQZ	0.0
Destruction of the Biosphere, Timeframe of Global Climate Change: A Last Ditch Strategy to Fight for Human Survival  https://t.co/zRfWimOoob https://t.co/uaW34rjaUn	1.0
RT @ClimateTracking: https://t.co/WxGLIwSAnV   Report on this year's pivotal climate change conference with us! https://t.co/zOlKuaU9FL	0.0
What is sustainable agriculture? https://t.co/wwdORYyv3J #climatechange #climateaction  #environment  #energy https://t.co/mdXqbSO277	0.0
In this webinar, discover how AWN CyberSOC™ can secure your #cloud: https://t.co/zMEqRtP9Pg #cybersecurity https://t.co/M1z5SPgZMR	0.0
4 Basic Digital Marketing Options We Forget About https://t.co/O1VxRIVBEh https://t.co/lWhDdTxQ0m	0.0
Making Predictions with Data and Python   ☞ https://t.co/7D30lsRtQx   #machinelearning #datascience   ryMy5-KG2E https://t.co/HJlPW9SvpJ	0.0
Buy Bitcoin With PayPal! Also with CC, paysafecard, Skrill, OKPAY https://t.co/Qdq3dxXr95 #btc #bitcoin 14 https://t.co/E4uBUrj74E	0.0
Cybercrime Magazine homepage update. Latest #cybersecurity facts, figures, predictions, and statistics; expert contributors, podcast videos, #cybercrime infographics, women in cyber, careers, and more. Published by Cybersecurity Ventures @CybersecuritySF https://t.co/pk1oMNg2nf https://t.co/kdTtD5ubDd	0.0
@poconoraceway @Elliott_Sadler @NASCAR_Trucks Why yes, yes I was. https://t.co/4hQfxBXn1E	0.0
This one was more than I could handle His jaw is rotted, he has magots in his mouth the smell is sickning I couldn't stay for the cleaning I'm sorry. The vet says she can only try with intense antibiotic for 15 days &amp; deep cleanings He deserves a chance at life without pain https://t.co/Jcdd9Uv8cm	0.0
Remember way back when in issue #666 where Eddie Brock captured and FistFucked Spider-Man using the symbiote as lube https://t.co/GLBJ8Zf0sk	0.0
GG2020 demo character select looks like it's from a modern mobile game https://t.co/T88gLKruvA	0.0
What Will It Take to Stop Coronavirus? https://t.co/A10Yw2igBD https://t.co/dy2UpAME5K	0.0
“This could be a massive disaster”: What happens if the coronavirus hits China’s internment camps? - https://t.co/PoLUw5hDUK https://t.co/mNRpk42oG5	0.0
2/5 Q. Should I be worried about #coronavirus?  A. It’s appropriate to be concerned and to take steps to protect yourself and those around you from infection. https://t.co/NIdnAZ0pbX	0.0
A guide to coronavirus face protection https://t.co/dhYB7yr33l https://t.co/UHAOCYruSY	1.0
Have you had contact with novel coronavirus cases? This is what you should do if you're a public health professional / healthcare practitioner: https://t.co/y2Y5akVCcM#2019-nCoV https://t.co/OxxRJxLDP2	1.0
RT @annoyyyinlady: Mood #coronavirus https://t.co/EH0iIqt3BZ	0.0
This is a super quick drawing I made so please dont focus on my quality, my intention isnt to brag about my skill rn it's to brag about my digital notebook and how happy I am to be able to make digital art with and actual pen and paper like the 21st century neanderthal i am https://t.co/uplElNlqb0	0.0
Ease of profit with the free daily search and collect 1000 pieces, then pull them on the myetherwallet,the currency price today $0.048 $ * 1000 = 48$ And remember that the season for digital currencies is on the rise https://t.co/llfV4RURru   @cctip_io  airdrop 2004000 AFDLT 50 https://t.co/n1dxsHtEEv	0.0
How to register cybercrime complaints online read more https://t.co/s9ATyp2ZMH https://t.co/ICowycKvkO	0.0
We heard there was a shortage of toilet paper because of the coronavirus...   so, we called up our friends at @QuiltedNorthern and struck a deal to give you all free bitcoin AND free shipping on all your toilet paper needs. https://t.co/b3zRkTlwfM	0.0
What is the reality of climate change that is facing us? How likely is it that we will limit warming to 1.5, or 2 degrees? @GreenHouse_UK &amp; Green European Foundation discuss these questions and more this September.   Secure your free ticket here: https://t.co/GIC4uQxs7U https://t.co/MNyNs7ek1Q	1.0
7 Principles for Solving Climate Change with Clean Technologies https://t.co/6z6lUNx10O https://t.co/eLuellFSW3	1.0
Five community-based programs that are helping people confront—and cope with—the mental health consequences of climate change: https://t.co/bCojuygkP3 via @yesmagazine https://t.co/NqktbnX0TD	1.0
short-assed racist marxist thug &amp; mental retard al sharpton says the murder of south african farmers is not happening... but then he also claims cleopatra was black &amp; global warming is a bigger threat to folks in south chicago than gang violence. prick of the year - every year! https://t.co/6aM9r1fVQP	0.0
What does planting trees have to do with saving the environment? https://t.co/MPVLDEnDkE #climatechange #climateaction  #environment  #energy https://t.co/gtEmwplHTf	1.0
How Cleantech Investments Bring Significant Benefits in Tackling Climate Change: https://t.co/7z78rXVLRj#climatechange #climateaction  #environment  #energy https://t.co/EJxF47Heh1	1.0
You can now bet for and against “global warming” with an online “climate bookie” https://t.co/CWiuw92B7whttps://t.co/YVSHogppMW	0.0
Imagining What Birds Think of Climate Change https://t.co/bI1SoipsiK https://t.co/FJ5J8tW7SI	0.0
Day and weekly tickets are available on our mobile app - your phone is your ticket! https://t.co/xfqgXpEhY2https://t.co/SoL0DoMOds	0.0
New digital health platform to help those with cancer scoops award https://t.co/p5li6cCvzUhttps://t.co/UFYYGfQ6PD	0.0
free sketch #¿ for @Techno_God111!  Acid Goblin hacks nemitz's computer. That is of course only the monitor but nemitz is ignorant and probably thinks that part is the computer. https://t.co/nIn5FeeaKm	0.0
FinTech is evolving rapidly, and its implications for payment processes are growing exponentially. Learn more from our Enterprise Payments experts on how this could streamline your business: https://t.co/tsNoJ3xzs3https://t.co/yphZ3L5UPQ	0.0
Bitcoin Fell 50% From $6,000 in 2018 After this Key Signal Lit, and it’s Flashing Again https://t.co/wQbubHVbHR	0.0
@Saint_BITCOIN @bitcoin2020conf These guys need the bubble balls instead. Much safer. https://t.co/cboDmXLM3Y	0.0
Old Years Night the 7th Day of the 12 Days of Christmas, guests have arrived, some seeking refuge from pyrotechnics, others to see in the New Year with friends, everyone is feasting and sharing the story of How The Animals Got Their Tails all are content, all is peaceful https://t.co/PDq9MySC8B	0.0
CACTUS JACK FOR HOT WHEELS. FORGIATO. JBL. RIOT SHIELD !! FOR A COUPLE HOURS DONT SLEEP https://t.co/AJ4e7OI3tq https://t.co/vD5jPwryGa	0.0
Ready Player One - Vfx Breakdown https://t.co/xcTMado35z   Digital Domain https://t.co/nm2ZOukWD1https://t.co/tin7V95Grr	0.0
From store closures to coronavirus, retailers face challenges in 2020 — but no apocalypse https://t.co/0JVuq11eNphttps://t.co/CrpCe5mYKw	1.0
RT @OfficialAbdiel: This really the Coronavirus?! https://t.co/3YXEv39caQ	0.0
m-mobile game.   wen qing?????? hand in marriage ma’am? https://t.co/Yn7tHDEJhF	0.0
Curious about the Coronavirus? Where it came from &amp; why? Or Autism, Alzheimer's, Addictions, Antichrist, Bitcoin, Creationism, Evolution, Libido, Mass Human Extinction, Murder, Political Cowardice, Suicide, Why Cops Kill? Many Answers Are  In My Book: https://t.co/LiX5IFJ1dI 41 https://t.co/4erZ2sWvun	0.0
RT @igent_io: 'Pandemic drone' could join COVID-19 fight #iot #iiot   https://t.co/AVxCMVKIpMhttps://t.co/BcTBmUVzen	0.0
Hello guys so far we've experienced a lot of uncertainty in the stock market with traders running at loss but hey here is your chance to make the best of it  Inbox me now to get started today   Make your money do the better work investing in bitcoin and foreign exchange markets https://t.co/edjz2YzWFX	0.0
How climate change is changing lives https://t.co/UU6gCCDeae https://t.co/8yhj4LgGsi	1.0
@dougmcneall @jamesannan A photo of climate change https://t.co/l2s9k8dkB6	0.0
What Purpose Does The IPCC Serve? Learn more here: https://t.co/xobgwIbXGR #climatechange #climateaction  #environment  #energy https://t.co/cntYMBMfLb	0.0
Assembly member @laurafriedman43 speaking out on floor in favor of sb100!  Yay! Passionate about stopping climate change https://t.co/GeMJwHuCcg	0.0
True Reformers for New York’s Senate - https://t.co/y9qR7tViOt -  Beyond the chance to shake things up in Washington, this fall’s elections present voters with an opportunity to support reformers around the country who are out to change the political climate from the ground u... https://t.co/O18kscviGc	0.0
Paul Hawken talks with the American Institute of Architects AIA Committee on the Environment about transforming cities into carbon sinks, the role of architects in reversing global warming, and more... https://t.co/jKkCDMLDt5https://t.co/DPBlRLC9rL	0.0
More fires, flooding: 7 climate change predictions in new report https://t.co/yDh84XjUJ3 https://t.co/IxxZEeX6rK	0.0
”...you know... people think it’s heredital that their kids get asthma... when the truth is, that they’re getting fucked over.” Mark! Lopez on the climate change impact in local communities in CA https://t.co/aFqx6E6Zi5	0.0
New post (Leadership must act now on climate change) has been published on - https://t.co/CE46EphQ6w - https://t.co/8hbcQsvgk4 https://t.co/O2a37w7QBC	0.0
@double_moonbow Hi I'm Jack, a digital artist who really loves Vento Aureo   I draw for fun but my commissions are always open 🤗🤗 *check pinned tweet https://t.co/oGPr7DsSKJ	0.0
If you were to make a smart move and choose a mobile app category, which one would you pick? Well, we have made it so easy for you! Read about the most lucrative app categories here https://t.co/oyiB4NDKi2https://t.co/omDTx5zJ5C	0.0
Want to see more of Kyle Kriesel of @DTmodelmgmt, check out the premier issue of @fashionablymale Magazine. This sexy shot was taken by @shotbylester.  Order your digital copy here: https://t.co/HYSkEVTiR4https://t.co/AvMJsNvcSh	0.0
Blackbug Virtual Reality Glasses 3D VR Box Headsets For 4.7 Inch Mobile Phones &amp;#8211; White   https://t.co/dwVXeCLhxj https://t.co/6iz1C3kEsF	0.0
AK66 6 Finger Mobile Game Controll...: List Price: $13.47 Deal Price: $9.89 You Save: $26% https://t.co/2knmYwhg7e https://t.co/ZQ1WFYgpE8	0.0
@Kyuubeeb Hello! I’m Kate and I’m a 5th year BFA student who loves digital illustration, here’s a small selection of my work from the past year. https://t.co/3kRJSZ9qJ6	0.0
Join us on Wednesday morning for our Patriot’s Day Memorial. Wear your Red, White, and Blue. https://t.co/tE4e4mmrD6	0.0
Why Progressive Web Apps Are The Future of Mobile Web: https://t.co/YFRtpulTmA - well put together overview with lots of great references and case studies! https://t.co/QMUJfOCPal	0.0
News release: @mccneb partners with @facebook to deliver new online digital marketing program   https://t.co/96PDdKw5Ay https://t.co/dUmqpxGyV6	0.0
@adulawo @obinna_70 @Rayscode @PoliceNG_CRU @officialEFCC @AJEnglish @BBCWorld They are prepared for this, anti riot tear gas launchers, water cannons and riot police APC’s Have been deployed to police commands across the nation. https://t.co/aWIe9sl8Uq	0.0
@no_silenced 68’ Cutlass Oldsmobile Supreme w/650 rocket motor. A hand me down from grandma. (Not the one pictured) https://t.co/8QGCoqrLOK	0.0
Tactical reports should be configured &amp; delivered in a way that outlines business-oriented risk metrics that provide InfoSec teams and Business stakeholders with the visibility they need on the spot. https://t.co/vUIKBeegep  #cybersecurity #databreach #ransomware https://t.co/c5QvMekVL5	0.0
@CaseyAffleck1 @Randy_Couture @McConaughey @BenAffleck @zachbraff @JimmyKimmelLive @JimCarrey @mattreevesLA @maxsmerling @makeitright @JeromeBaker420 @GIassPipes @Waterpijpbong @BonginGlass @chameleonusa @RedbeardGlass @SaltGlassArt @TheBernGallery @4point0glass @cornerstoneglas @edrosenthal @stevedeangelo @Svante_Thunberg @IsraelCannabis @BedrocanInfo @GrnOrganicDutch @Neuro_Congress2 @CanopyGrowth @Aurora_MMJ @KirkTousaw @JustinTrudeau @havapoel @rjpbaan @KUBO_nl @SchoutenLegal @ToineMandersEP @joepvanmeel @BitCoin_Invest_ @rhylbitcoin @company_007 @1F_sts @VINAY99996 @MaJaVi_ @rlpams @asr3followoc @EliasTheodorou @Lunar_eclipse71 @Ricknroll02 @DrMansoor01 @narendramodi ..was to accuse them of being involved in heresy or magic. But others say they had the holy grail.* Or did have evil intentions; there are a lot of ‘conspiracy’ theories.   *That’s not really a cup if you ask me. It’s true love.   The last 2 events could’ve been planned to be on.. https://t.co/tAngfIMdMN	0.0
Remember to check in on the @steelers Mobile App at Heinz Field to score a special game day photo to post on social media! https://t.co/UK8cKCeNOy	0.0
U.S. financial institutions were surveyed about their mobile banking and payment practices: Banks and credit unions continue to develop new mobile banking products and enhance current ones to stay competitive.  Read the @BostonFed report here: https://t.co/FwRMjfz3Zh https://t.co/VBYxQ1FYEx	0.0
#coronavirus in a nutshell 😂😂😂 https://t.co/EmPwUD6S3T	0.0
The #coronavirus has nothing to do with @Corona beer, despite what many people around the world seem to think https://t.co/xwjkAZz5LX via @nparts https://t.co/v44w1LPxH6	1.0
