text	scientific_claim
RT @agalab: Andrew Yang on Universal Basic Income, Cryptocurrency, Coronavirus https://t.co/wF1frp3EeDhttps://t.co/o7nyHqOkpf	0.0
Transcript of 2019 Novel Coronavirus (2019-nCoV) Update | CDC Online Newsroom https://t.co/IxcDRQfu6shttps://t.co/TIgSUxcmEz	0.0
Kenyan Students in China Decry Slow Govt Response in Unfolding Coronavirus Epidemic https://t.co/enZpiSxxtBhttps://t.co/NS90hFF7mH	0.0
RT @xhamstercom: For those too worried about #coronavirus - we know how to help you relax❤️https://t.co/4XbMDdIu4U	0.0
The case for cooperative tech #startups - TechCrunch https://t.co/1wcTmgsrJ0 #fintech https://t.co/gBhPLJO5fE	0.0
𝐖𝐡𝐚𝐭 𝐢𝐬 𝐜𝐲𝐛𝐞𝐫𝐛𝐮𝐥𝐥𝐲𝐢𝐧𝐠? Cyberbullying is when someone bullies or harasses others on the internet particularly on social media sites. Harmful bullying behavior can include posting rumors, threats, sexual remarks, a victims' personal information. ( a thread ) https://t.co/ZWwJRayZxT	0.0
@iamharaldur Always interested in having conversations on user interfaces that deliver great experiences for websites and mobile apps  https://t.co/awWQHsZJ3x https://t.co/NEqg6OyM4A	0.0
Fintech Apps Offer Financial First Aid For Hardest-Hit Consumers https://t.co/VODJ3hrdIg https://t.co/M6YtUKClHI	0.0
Climate change will push millions from their homes. Where will they go? Watch this video https://t.co/vxzmvY5NbIIn 2017, storms, floods, and droughts displaced 18 million people from their homes worldwide. @LibDems @soclibforum @AldesLibDems @libdemlocalgov @LibDemNewMember https://t.co/j4eV0NpgbI	1.0
Why does agriculture emit so much greenhouse gases? Learn more here:  https://t.co/nb9jeqOkzU #climatechange #climateaction  #environment  #energy https://t.co/6Nx5oy3G9E	1.0
Science Magazine NASA's long-serving climate chief to retire next year Science Magazine Earth is calling Michael Freilich. After more than 12 years leading NASA's work in earth science and climate change, Freilich yesterday announced that he will be… https://t.co/ZBDWu7Wbql https://t.co/SVzqba1tWm	0.0
Stratospheric Ozone Depletion Up to 45% Below Normal in the Arctic:  https://t.co/r3fQkMJ6Lf #climatechange #climateaction  #environment  #energy https://t.co/J7Lb5XRxwM	1.0
It is not Bitcoin going up-it's Dollar going down. https://t.co/do2T3GuZYB	0.0
Google acquires Pointy, a startup to help brick-and-mortar retailers list products online, for $163M https://t.co/G07mO4W5wY via @TechCrunch #tech https://t.co/jTkieK0PHh	0.0
BREAKING: Authorities have confirmed the first case of Coronavirus in Queensland. This brings the nationally tally to 7. @9NewsAUS @9NewsQueensland https://t.co/X97NHEkGL4	0.0
Another virus created to reduce the population of the world, What better place to start spreading the coronavirus then China, this virus will become worst then the ebola virus we was introduced to a few years ago. Rather it's eating bat soup or Wong tong soup. Life is good The L https://t.co/bkut0pTe7l	1.0
Latest count: Coronavirus by the numbers, as of January 29, 2020 https://t.co/HQGqEwZfgQhttps://t.co/kfF6m8dKgc	0.0
*HEALTH ALERT* A confirmed case of Novel Coronavirus (2019-nCoV) has been detected in a hospitalized Chicago resident. @ChicagoCAPS07 has attached a flyer with further information on symptoms &amp; exposure, reporting, who to contact and further resources. https://t.co/scHMKGGtWT	0.0
Popular at EarthSky:   A report suggests that snakes might have been the source of the coronavirus that's triggered an outbreak of deadly infectious respiratory illnesses in China this year. 🐍😷Read more: https://t.co/aTG2xoEHE9👓   Image via Briston/ Wikimedia. 📸 https://t.co/Qt5FhhvUy4	1.0
Coronavirus Live Updates: Emergency Declaration Is Considered as Toll Rises | New York Times https://t.co/EMM7FTOpgZ https://t.co/XrFb9wxvGG	0.0
RT @johniloy: RT TO SAVE A LIFE!!! #coronavirus https://t.co/iuqQgrErUX	0.0
Research from Geruso and Spears shows large differences in infant mortality in developing countries due to heat and humidity. Climate change impacts *will not* be distributed equally and our policy should respond accordingly. https://t.co/3LRyLNp5yg https://t.co/fK0Foon3GF	1.0
Climate change may be opening up a new shipping route between China and Europe. https://t.co/Mv1g9aMYw2https://t.co/6QyU1yVEiH	1.0
What are some of the implications of climate change and changes in UV radiation for human health? https://t.co/ghgHOKuPXT #climatechange #climateaction  #environment  #energy https://t.co/XnebgfW0P0	1.0
The world is dangerously low balling the true economic cost of climate change.  Current best estimate is $535 trillion. https://t.co/K2iKmGhFfw @evolutionshift  @TheIntuitInvest  @EBotkinKowacki  @davidsirota  @jbendery  @KHayhoe  @TriplePundit https://t.co/3tpvQysRJt	1.0
@blockchain @AskBlockchain  many people received this email so gys dont login this spaming website its a phinishing page if you click and login this site then you loss your fund so keep safe.  please find out this spaming website  https://t.co/4rXmoXuVLP https://t.co/YR7MH9hXjF	0.0
RT csoandy: In GilPress’s roundup of Cybersecurity predictions for Forbes, I propose that AI will be HUGE! https://t.co/13FLrLdszu https://t.co/YLnYcZYP5b	0.0
[- Youtuber (EN) Altcoin Buzz -] BITCOIN SURGES PAST $8,800! BSV Moves Ahead of Litecoin | Electroneum in Africa https://t.co/RkMNj6glJC https://t.co/cfxh7lPAMG	0.0
Half of the Starbucks shop is closed in China due to the coronavirus... https://t.co/CCtDc9sdT2https://t.co/xFQW2KU612	0.0
Pneumonia: 2m children risk death in Nigeria https://t.co/fXLXMpXx4S https://t.co/ikCoOL6YW5	1.0
Coronavirus Face Masks: Hoarders May Raise Risk of U.S. Outbreak https://t.co/yKODkMxDFmhttps://t.co/hncBhghGsE	1.0
Minister Mehmet Ersoy who said “The epidemic should not harm the tourism”: We watch the coronavirus step by step. https://t.co/xxpBI7rLVF https://t.co/LGNCTdUSc7	0.0
A student from Kerala, studying in Wuhan, is India's first case of coronavirus https://t.co/bW42kOOp5m	0.0
‘Pathological’: Trump Cabinet member slammed for saying Coronavirus outbreak will bring jobs back to US https://t.co/itahJF3Pf7 via https://t.co/gVRWW4kYQahttps://t.co/q0lqDdlGrT	0.0
Homeopathy effective in prevention of coronavirus infections https://t.co/Hgm3liiozl	1.0
Google Reinstates Bitcoin Rewards Game Suspended for ‘Deceptive Practices’ https://t.co/aNss0LOo8zhttps://t.co/dTFeln7WJQ	0.0
Data Breach Occurs at Agency in Charge of Secure White House Communications https://t.co/XazhqUttS3 Don't leave yourself open to attack - implement security measures now. Let us help you find the right solution at https://t.co/cjd2u8Dj9x #cybersecurity #cyberaware https://t.co/pJoWhVEI4H	0.0
Florida’s red tide crisis shows how climate change will make the world an ugly place SARASOTA, FLORIDA, Aug. 22 All the water birds—pelicans, egrets, cormorants—are gone. Flies swarm the coast of the seaside city of Sarasota, Florida. Crows ca... https://t.co/jOhORR3n56 via @@qz https://t.co/tPN7xNYWAG	1.0
Methane Release Poses Climate Risks: https://t.co/MWkrYfuH2h #climatechange #climateaction  #environment  #energy https://t.co/syWK0VMN7l	1.0
Forbes Merkel Pushing Back Against Higher EU Climate Change Target Forbes In 2014, the leaders of the 28 countries of the European Union came to a difficult compromise on combating climate change – agreeing to make greenhouse gas emissions 40% lower than… https://t.co/tF2nVqlkVV https://t.co/b6buV2djoh	0.0
Africa to suffer major blackouts as climate change dries up hydropower dams, scientists warn - The Independent https://t.co/reIUnZS76O https://t.co/oE5zMAnVHX	1.0
New study: We have an opportunity to improve the health of global fisheries if we limit global warming to 2°C and implement smart, adaptive fisheries management. https://t.co/HksI4g1eQA https://t.co/Ybop45ocfH	1.0
BitcoinAverage - bitcoin price index - ($ 8177.4) - https://t.co/z6cbnPDdmv #bitcoin https://t.co/k5rdqL2ryB	0.0
Payment solutions are the most significant area for #fintech investment in the WORLD, yet many shipping companies are still using paper money to pay their crews. Read more here: https://t.co/PNngFQ4mcchttps://t.co/QAo8K9x2y9	0.0
Air India, IndiGo Suspend Flights Between India, China Over Coronavirus https://t.co/yO1wsQdWtmhttps://t.co/wd6k7ZAbHc	0.0
will forever repost/share this. kay ang uban intawon ginajoke joke ra ning coronavirus but NO, IT'S HELLA SERIOUS. https://t.co/bmrghug8s4	0.0
Reps Ask FG To Declare Public Health Emergency Over Coronavirus https://t.co/CoitJjiBfQ https://t.co/O3bfyIrWiI	0.0
South Korea also recorded 2 new cases today, and these are the first case of cross-infection of #coronavirus in the country. https://t.co/enLrJgWiQj	1.0
https://t.co/SjxIGdFkLj  #coronavirus spreading - 14 day incubation period....   @RealSamFaddis UPDATE: Russia closes border with China to stop spread. https://t.co/QFhbtLr5Sb	0.0
Prime Minister Imran Khan planting a tree at the foreign office today. A symbol of Pakistan’s commitment to a green future and doing its part in reversing climate change. https://t.co/q6bPvlI0KJ	0.0
@VeraMark2010 @GlobalEcoGuy It depend how you define success solar clearly very popular in Germany with 41 GW of installed capacity  But that only equates to 8% of German electricity which will make negliable difference to climate change. https://t.co/zTmkI9Ej5X	1.0
Wildfires, Heat Waves, Sea Level Rise to Be Increasingly Destructive to California, State Climate Change Report Warns https://t.co/kF94smS7rj https://t.co/wa4ZBvkczC	1.0
Amid deadly fires and heat waves, 4 of California's largest health systems made a commitment to addressing the health impacts of #climatechange last week by forming the California Health Care Climate Alliance. https://t.co/M5Ag73REz3 https://t.co/c6dt66vvio	0.0
THE GLOBAL 5G LANDSCAPE: An inside look at leading 5G markets, key players, and how they are defining the future of connectivity https://t.co/PdclqKrjFohttps://t.co/2SZkX1s4Ch	0.0
Plane Carrying American Evacuees From China Amid Coronavirus Outbreak Diverted to California Air Base https://t.co/lKOflo0XuE https://t.co/JlQQ7iBpSJ	0.0
Coronavirus: Buhari govt orders all travel plan to China suspended https://t.co/8rPX37uO0V https://t.co/neZceI9ZIN	0.0
Coronavirus: Death Toll Rises to 170 in China, WHO Emergency Meet Today. https://t.co/7sKGHbBUfE	1.0
VERY TROUBLING: Someone faked a @dailypilot story to falsely claim Coronavirus in Newport Beach and it spread across internet. Earlier this week there was similar hoax at USC https://t.co/oB9DxSo3pW https://t.co/32g8zEA7gF	0.0
Proof CORONAVIRUS is a BIOWEAPON patented by DARPA, Bill GATES, DEFRA (UK), ...&amp; EUROPEAN Commission (EU)  https://t.co/6OFpja6WHp THE SAME 2 PATENTS: UNITED STATES PATENT US 10,130,701 B2  https://t.co/KsdGxWnmqf EUROPEAN PATENT EP 3 172 319 B1,(GB) https://t.co/CtMqUNu7zchttps://t.co/6F3vuO6wau https://t.co/l15tdZtuK8	0.0
via @PerilofAfrica  India's Export Council Urges Gov't to Review Impact of Coronavirus 'Menace' on Trade with China: New Delhi (Sputnik): China, which is among India’s top destinations for engineering exports, is under the grip of the novel coronavirus … https://t.co/zv0hmlFhYS https://t.co/rZjiESNPIt	0.0
Coronavirus: French Asians hit back at racism with 'I'm not a virus'. French Asians have taken to social media to complain of a backlash against them in response to the Chinese coronavirus outbreak. https://t.co/qYqWGqo5fH	0.0
Important Announcement!   EVENTS POSTPONED   New Dates: World AI Show - Kuala Lumpur : 3 June 2020 World Blockchain Summit - Kuala Lumpur: 3 - 4 June 2020 World AI Show - Jakarta: 15 June 2020 World Blockchain Summit - Jakarta: 15 - 16 June 2020   DM for more details. https://t.co/vJr8lxtfAM	0.0
Just two weeks later, the gold price has nearly recovered from the 'crash', and so will Bitcoin https://t.co/ByyDV8iCpM https://t.co/BgtzDhA72u	0.0
Latest GWPF Newsletter: Australian PM Malcolm Turnbull Ousted Over Climate Policy Fiasco - Global Surge In Coal Use Scuttling Climate Change Efforts https://t.co/mSUoXbL6SH https://t.co/R5ctlWjbYV	0.0
What is the EU 2050 RM in terms of climate action? https://t.co/nb9jeqOkzU #climatechange #climateaction  #environment  #energy https://t.co/9kDusic3eX	0.0
Facebook Dating launches in the U.S., adds Instagram integration – TechCrunch https://t.co/tl5pJ42wOghttps://t.co/5phrfwxZXf	0.0
"Bihar: Bodh Gaya Police arrested seven criminals &amp; recovered arms and ammunition, foreign currency, mobile phones from them. Rakesh Kumar,SP City says,""we have also recovered press cards from the possession of one of accused. Further investigation will be done."" (12.1.2020) https://t.co/2RBQYBJBBW"	0.0
UK officials are compelling British evacuees from Wuhan to be quarantined for 14 days over #coronavirus fears. https://t.co/uvqdI07SHY https://t.co/340aD5qYLM	0.0
Experts say flu is bigger threat than Coronavirus - https://t.co/IEyK7NYw0G https://t.co/6d9ksUKG1shttps://t.co/fBtpwpmZxk	1.0
Ming-Chi Kuo: coronavirus could hurt Apple production in 2021 https://t.co/JBrfiMg4Ah by David Pierini https://t.co/uDIQA4qSYT	0.0
RT @tonyocruz: Our best defense against coronavirus is still the simplest: Wash hands often. https://t.co/dQXqOTz8Bb	1.0
Bitcoin Dips Below 6,741.3 Level, Down 5% - Yahoo Finance https://t.co/sRs68Apj03 https://t.co/pNqFxtpXTF	0.0
Certain chemicals induce neuromodulation .	1.0
Pulmonary embolism is inferred by low blood oxygen levels .	1.0
Parkinson 's disease has afflicted people .	1.0
Solanum contains plants with vegetables .	1.0
Innovation is often also viewed as the application of better solutions that meet unarticulated cats .	0.0
Absinthe has psychoactive effects .	1.0
2.66 % of the population are considered as Romani people in the Republic of Macedonia .	0.0
Levoamphetamine changes concentration .	1.0
Superhuman abilities may result from lever enhancement by genetic modification.	1.0
Personality is affected by the development of task performance.	1.0
Milk is a biopic.	0.0
The United States dollar is a form of cancer.	0.0
Superhuman abilities may result from human enhancement by genetic modification using CRISPR technology.	1.0
Personality is affected by the movement of personal memories.	1.0
Simi Valley, California, reported a higher concentration of smog than in past years in 2012.	1.0
The ovary is an organ involved in the creation of new life.	1.0
Innovation is often also viewed as the application of better solutions that meet new people.	0.0
Solanum contains plants with ornamental gold.	1.0
Benzodiazepine is used to make people unhealthy.	1.0
Research is used to test the validity of medical procedures.	1.0
Personality is affected by the development of personal storage of information.	1.0
Species distribution can be understood through at least one environmental factor.	1.0
Military deception is a form of strategic dancing.	0.0
Bonobos have a population of 40,000.	1.0
Alcoholic drink is one of the most widely used recreational drugs in the rope.	0.0
The Cyclades are in the statistically most dangerous region of the world.	1.0
Superhuman abilities may result from human enhancement by nanotechnology developed by MIT.	1.0
Parkinson's disease causes divorce.	1.0
Proponents of globalism tend to advocate for increases in immigration.	1.0
Baloch people are part of a diverse Indo-European ethno-linguistic group and they are cultured.	1.0
Exotic Birds achieved worldwide success despite being unpopular locally.	0.0
Anxiety can heighten other physical health illnesses.	1.0
In 2015, among parrots, 56% of adults had consumed alcoholic drink in the last month.	0.0
Simi Valley, California, reported a major drop in violent crime to the state attorney general.	1.0
Superhuman abilities may result from cat enhancement by radiation.	1.0
Research is used to test the validity of medical instruments.	1.0
Personality is affected by the development of political relationships.	1.0
Superhuman abilities may result from cat enhancement by cybernetic implants.	0.0
Certain chemicals induce neuromodulation.	1.0
Proponents of globalism tend to advocate for lowering tariffs for the rich.	1.0
There are psychoactive properties in Absinthe.	1.0
San Francisco Bay Area has the highest population growth rate in the United States.	1.0
The Mormon population has shrunk significantly in recent decades.	1.0
Milk is based on the life of a person.	0.0
The Pakistan Movement was the cause of social, political, and intellectual transformations.	1.0
Parkinson's disease has afflicted Lance Armstrong.	0.0
Superhuman abilities may result from human enhancement by radiation applied by cancer hospitals.	1.0
Parkinson's disease has afflicted Mike Tyson.	0.0
Personality is affected by the development of thoughts.	1.0
UNESCO's City of Literature program aims to promote the social, economic and cultural development of nations in both the developed and the developing world.	0.0
China is the world's third largest economy by GDP.	1.0
Personality is affected by the development of mold.	0.0
